{"authorityEpoch":"1","authorityId":"authority:fixture","causationUrn":null,"commandId":"00000000-0000-4000-8000-000000000004","correlationId":"00000000-0000-4000-8000-000000000005","data":{"delta":"3"},"eventHash":"81d0e30c527159edcd534219c7d3def799625dd23ef81ba27567247385f89e50","eventType":"counter.changed","eventUrn":"urn:uuid:00000000-0000-4000-8000-000000000001","inputHash":"09c2b1bcf0373233a0cb94c893fc4a5f1a04ac39e21e34cf5240463f81427a6f","occurredAt":"2026-10-09T09:00:00Z","planHash":"ba0e0c300c300ccc2ef51a71e4d1bc5318db9a881ed9023d216bcbb2b18f4f14","previousHash":"0000000000000000000000000000000000000000000000000000000000000000","processUri":"process://data-gateway/counter.change/v2","schema":"data-plane.domain-event/v1","schemaVersion":1,"streamUrn":"urn:uuid:00000000-0000-4000-8000-000000000003","streamVersion":"1","tenantId":"00000000-0000-4000-8000-000000000002"}
